<?xml version="1.0" encoding="UTF-8"?>
<listaclientes xmlns:xsi="http://www.w3.org/2001/XMLSchema-instance"
    xsi:noNamespaceSchemaLocation="clientes.xsd">
    <cliente español="si">
        <nombre> Juan </nombre>
        <apellido> Sanchez </apellido>
        <dni>77883322P</dni>
        <compras>45000</compras>
        <regalo>bolsa deporte</regalo>
    </cliente>
    <cliente español="no">
        <nombre> Jose </nombre>
        <apellido> Diaz </apellido>
        <dni> 67839021A</dni>
        <compras> 45000 </compras>
    </cliente>
</listaclientes> 